{
  "schema_version": "2.0",
  "scanner": {
    "name": "moodle-scanner",
    "version": "3.0.0"
  },
  "target": {
    "url": "http://127.0.0.1:8401/",
    "reachable": true,
    "is_moodle": true,
    "markers": [
      "moodle-session-cookie",
      "m-cfg-script",
      "moodle-asset-urls",
      "moodle-keywords-meta"
    ]
  },
  "started_at": "2026-10-18T19:43:00+00:00",
  "data": {
    "fingerprints_latest_tag": "v5.3.0",
    "fingerprint_tags": 590,
    "fingerprint_files": 243,
    "advisories_count": 733,
    "advisories_latest_published": "2026-10-15"
  },
  "version": {
    "status": "exact",
    "version": "4.1.2",
    "candidates": [
      "4.1.2"
    ],
    "range": {
      "min": "4.1.2",
      "max": "4.1.2"
    },
    "branch": "4.1",
    "confidence": "high",
    "method": "file-fingerprint",
    "evidence": [
      {
        "path": "/lib/javascript-static.js",
        "status": 200,
        "outcome": "match",
        "sha1": "94216ace27f3bb16789480d6cd9929d0aa7380ad",
        "matched_versions": "4.0.0-beta .. 4.1.11 (34 tags)"
      },
      {
        "path": "/theme/boost/style/moodle.css",
        "status": 200,
        "outcome": "match",
        "sha1": "b1b96fab2c355425f56ad3daefe6818132cc5227",
        "matched_versions": "4.1.2"
      },
      {
        "path": "/course/format/amd/build/local/content.min.js",
        "status": 200,
        "outcome": "match",
        "sha1": "cbfd154ed74f5506fa3b88f53ec786d9be5283ce",
        "matched_versions": "4.1.2"
      },
      {
        "path": "/lib/editor/tiny/amd/build/editor.min.js",
        "status": 200,
        "outcome": "match",
        "sha1": "633a127d1c5c994eec15d8433d2608bd075eb48a",
        "matched_versions": "4.1.2"
      }
    ],
    "signals": [
      {
        "source": "http://127.0.0.1:8401/lib/upgrade.txt",
        "kind": "upgrade-notes",
        "branch": "4.1"
      }
    ],
    "notes": [
      "even exact/high identifies a match to bundled release fingerprints, not proof of installed server code; backported fixes and newer builds with identical public assets cannot be ruled out"
    ]
  },
  "advisories": [
    {
      "id": "MSA-23-0014",
      "title": "TinyMCE loaders susceptible to Arbitrary Folder Creation",
      "published": "2023-05-01",
      "severity": "Serious",
      "severity_level": "high",
      "cves": [
        "CVE-2023-30943"
      ],
      "trackers": [
        "MDL-77718"
      ],
      "url": "https://moodle.org/mod/forum/discuss.php?d=446285",
      "affected": [
        "4.1.0 to 4.1.2"
      ],
      "excluded": [],
      "earlier_unsupported": false,
      "fixed": [
        "4.1.3"
      ],
      "match": "version_match",
      "evidence_level": "version_only",
      "reason": "4.1.2 is within affected range 4.1.0 to 4.1.2 (fixed in 4.1.3)"
    },
    {
      "id": "MSA-23-0018",
      "title": "SSRF risk due to insufficient check on the cURL blocked hosts list",
      "published": "2023-06-19",
      "severity": "Serious",
      "severity_level": "high",
      "cves": [
        "CVE-2023-35133"
      ],
      "trackers": [
        "MDL-78215"
      ],
      "url": "https://moodle.org/mod/forum/discuss.php?d=447831",
      "affected": [
        "4.2.0",
        "4.1.0 to 4.1.3",
        "4.0.0 to 4.0.8",
        "3.11.0 to 3.11.14",
        "3.9.0 to 3.9.21"
      ],
      "excluded": [],
      "earlier_unsupported": true,
      "fixed": [
        "4.2.1",
        "4.1.4",
        "4.0.9",
        "3.11.15",
        "3.9.22"
      ],
      "match": "version_match",
      "evidence_level": "version_only",
      "reason": "4.1.2 is within affected range 4.1.0 to 4.1.3 (fixed in 4.1.4)"
    },
    {
      "id": "MSA-23-0023",
      "title": "Stored self-XSS escalated to stored XSS via OAuth 2 login",
      "published": "2023-08-21",
      "severity": "Serious",
      "severity_level": "high",
      "cves": [
        "CVE-2023-40320"
      ],
      "trackers": [
        "MDL-78685"
      ],
      "url": "https://moodle.org/mod/forum/discuss.php?d=449644",
      "affected": [
        "4.2.0 to 4.2.1",
        "4.1.0 to 4.1.4",
        "4.0.0 to 4.0.9",
        "3.11.0 to 3.11.15",
        "3.9.0 to 3.9.22"
      ],
      "excluded": [],
      "earlier_unsupported": true,
      "fixed": [
        "4.2.2",
        "4.1.5",
        "4.0.10",
        "3.11.16",
        "3.9.23"
      ],
      "match": "version_match",
      "evidence_level": "version_only",
      "reason": "4.1.2 is within affected range 4.1.0 to 4.1.4 (fixed in 4.1.5)"
    },
    {
      "id": "MSA-23-0020",
      "title": "Remote code execution risk when parsing malformed file repository reference",
      "published": "2023-08-21",
      "severity": "Serious",
      "severity_level": "high",
      "cves": [
        "CVE-2023-40317"
      ],
      "trackers": [
        "MDL-78647"
      ],
      "url": "https://moodle.org/mod/forum/discuss.php?d=449641",
      "affected": [
        "4.2.0 to 4.2.1",
        "4.1.0 to 4.1.4",
        "4.0.0 to 4.0.9",
        "3.11.0 to 3.11.15",
        "3.9.0 to 3.9.22"
      ],
      "excluded": [],
      "earlier_unsupported": true,
      "fixed": [
        "4.2.2",
        "4.1.5",
        "4.0.10",
        "3.11.16",
        "3.9.23"
      ],
      "match": "version_match",
      "evidence_level": "version_only",
      "reason": "4.1.2 is within affected range 4.1.0 to 4.1.4 (fixed in 4.1.5)"
    },
    {
      "id": "MSA-23-0019",
      "title": "Proxy bypass risk due to insufficient validation",
      "published": "2023-08-21",
      "severity": "Serious",
      "severity_level": "high",
      "cves": [
        "CVE-2023-40316"
      ],
      "trackers": [
        "MDL-74289"
      ],
      "url": "https://moodle.org/mod/forum/discuss.php?d=449640",
      "affected": [
        "4.2.0 to 4.2.1",
        "4.1.0 to 4.1.4",
        "4.0.0 to 4.0.9",
        "3.11.0 to 3.11.15",
        "3.9.0 to 3.9.22"
      ],
      "excluded": [],
      "earlier_unsupported": true,
      "fixed": [
        "4.2.2",
        "4.1.5",
        "4.0.10",
        "3.11.16",
        "3.9.23"
      ],
      "match": "version_match",
      "evidence_level": "version_only",
      "reason": "4.1.2 is within affected range 4.1.0 to 4.1.4 (fixed in 4.1.5)"
    },
    {
      "id": "MSA-23-0042",
      "title": "RCE due to LFI risk in some misconfigured shared hosting environments",
      "published": "2023-10-17",
      "severity": "Serious",
      "severity_level": "high",
      "cves": [
        "CVE-2023-5550"
      ],
      "trackers": [
        "MDL-72249"
      ],
      "url": "https://moodle.org/mod/forum/discuss.php?d=451591",
      "affected": [
        "4.2.0 to 4.2.2",
        "4.1.0 to 4.1.5",
        "4.0.0 to 4.0.10",
        "3.11.0 to 3.11.16",
        "3.9.0 to 3.9.23"
      ],
      "excluded": [],
      "earlier_unsupported": true,
      "fixed": [
        "4.2.3",
        "4.1.6",
        "4.0.11",
        "3.11.17",
        "3.9.24"
      ],
      "match": "version_match",
      "evidence_level": "version_only",
      "reason": "4.1.2 is within affected range 4.1.0 to 4.1.5 (fixed in 4.1.6)"
    },
    {
      "id": "MSA-23-0036",
      "title": "Stored XSS and potential IDOR risk in Wiki comments",
      "published": "2023-10-17",
      "severity": "Serious",
      "severity_level": "high",
      "cves": [
        "CVE-2023-5544"
      ],
      "trackers": [
        "MDL-79509"
      ],
      "url": "https://moodle.org/mod/forum/discuss.php?d=451585",
      "affected": [
        "4.2.0 to 4.2.2",
        "4.1.0 to 4.1.5",
        "4.0.0 to 4.0.10",
        "3.11.0 to 3.11.16",
        "3.9.0 to 3.9.23"
      ],
      "excluded": [],
      "earlier_unsupported": true,
      "fixed": [
        "4.2.3",
        "4.1.6",
        "4.0.11",
        "3.11.17",
        "3.9.24"
      ],
      "match": "version_match",
      "evidence_level": "version_only",
      "reason": "4.1.2 is within affected range 4.1.0 to 4.1.5 (fixed in 4.1.6)"
    },
    {
      "id": "MSA-23-0032",
      "title": "Authenticated remote code execution risk in IMSCP",
      "published": "2023-10-17",
      "severity": "Serious",
      "severity_level": "high",
      "cves": [
        "CVE-2023-5540"
      ],
      "trackers": [
        "MDL-79409"
      ],
      "url": "https://moodle.org/mod/forum/discuss.php?d=451581",
      "affected": [
        "4.2.0 to 4.2.2",
        "4.1.0 to 4.1.5",
        "4.0.0 to 4.0.10",
        "3.11.0 to 3.11.16",
        "3.9.0 to 3.9.23"
      ],
      "excluded": [],
      "earlier_unsupported": true,
      "fixed": [
        "4.2.3",
        "4.1.6",
        "4.0.11",
        "3.11.17",
        "3.9.24"
      ],
      "match": "version_match",
      "evidence_level": "version_only",
      "reason": "4.1.2 is within affected range 4.1.0 to 4.1.5 (fixed in 4.1.6)"
    },
    {
      "id": "MSA-23-0031",
      "title": "Authenticated remote code execution risk in Lesson",
      "published": "2023-10-17",
      "severity": "Serious",
      "severity_level": "high",
      "cves": [
        "CVE-2023-5539"
      ],
      "trackers": [
        "MDL-79408"
      ],
      "url": "https://moodle.org/mod/forum/discuss.php?d=451580",
      "affected": [
        "4.2.0 to 4.2.2",
        "4.1.0 to 4.1.5",
        "4.0.0 to 4.0.10",
        "3.11.0 to 3.11.16",
        "3.9.0 to 3.9.23"
      ],
      "excluded": [],
      "earlier_unsupported": true,
      "fixed": [
        "4.2.3",
        "4.1.6",
        "4.0.11",
        "3.11.17",
        "3.9.24"
      ],
      "match": "version_match",
      "evidence_level": "version_only",
      "reason": "4.1.2 is within affected range 4.1.0 to 4.1.5 (fixed in 4.1.6)"
    },
    {
      "id": "MSA-23-0046",
      "title": "Authenticated remote code execution risk in course blocks",
      "published": "2023-12-21",
      "severity": "Serious",
      "severity_level": "high",
      "cves": [
        "CVE-2023-6663"
      ],
      "trackers": [